정부가 정한 규칙을 정확히 정의해야 하는 이유는, 사회를 구조를 보다 안정적으로 지탱하기 위함입니다.  정부는 법의 힘을 이용해 세계 전체를 다스릴 권한을 부여받기에, 그 힘을 남용할 시 위험으로 돌아올 수 있습니다.  그렇기에 주민들은 각 분야마다 다루는 권력의 분야를 분할해서 서로 상호 발전적인 관계를 만들어, 이후 지도자가 바뀌는 상황같이, 여러 변화를 겪는 도중에도 정부가 제 기능을 유지하고 세계가 긍정적인 변화를 추구하도록 해야 합니다.
178;정부의 일 처리에 대한 지침을 모아두었습니다.
179;헌법이란, 사회가 어떻게 통치될 것 인가를 정의한 수립 문서입니다.  헌법은 다른 정부 구조물이 설치 되기 전 우선적으로 제정해 두어야만 합니다. [Capitol|CapitolItem]에서 제정할 수 있습니다.
정부 선포하기
중앙정부 구조물을 설치하면, 구조물의 설정 창을 연 후 법률을 적은 후 통과 시켜 사람들에게 발표할 수 있습니다. 더 제정할 헌법이 없다면, 정부는 그 즉시 설립됩니다.

이미 시행되고 있는 헌법이 있다면, 서버의 설정에 따라서, 중앙정부 구조물이 설치되어있는 공간의 방 등급 수치가 헌법이 이미 시행되고 있는 방의 수치보다 높아야만 헌법이 받아들여질 수 있습니다.

덧붙이자면, 이후 업데이트를 통해 같은 서버 안에서 여러 정부가 동시에 운영될 수 있게 할 예정입니다.
180;정부의 수립 문서 입니다.
181;  인구관리는 주민의 직급을 나누는 기능으로, 정부를 통해 관리할 수 있습니다. 이 기능을 이용해서 어느 곳에서나 주민들을 특정할 수 있습니다 (권한, 법률, 등의 대상 설정 기능).

예를 들어, 벌목 기술이 3 이상인 플레이어들을 하나로 묶어, '나무꾼'이라는 이름의 하나의 직급으로 정의할 수 있습니다.  그 이후, '나무꾼' 에게 나무를 벌목할 수 있는 권한을 주는 법률을 제정할 수 있습니다.

인구관리는 [Census Bureau|CensusBureauItem]을 통해 관리할 수 있습니다.

또한 인구관리를 통해 직급을 나누어 급여를 지급할 수 있습니다.  주민이 직급의 조건을 준수하고 있는 동안 주기적으로 급여를 받을 수 있습니다.
182;주민들을 특정 기준에 맞추어 규정합니다.
183;플레이어는 [ZoningOfficeItem]에서 구역을 설정할 수 있으며, 법률로 지정한 특정 구역으로써도 사용될 수 있습니다.
구역이란 특정 범위를 선택해 지정해 둔 것으로, 구역끼리는 서로 영향을 미치지 않으며, 구역의 범위는 언제든지 변경할 수 있습니다.  구역은 구역지도의 안에서 지정 가능하며, 구역지도의 생성은 제한이 없습니다. 하지만, 같은 구역지도에서는 구역 범위를 겹쳐놓을 수는 없습니다.

구역은 법에 위배되지 않는 행동만 할 수 있도록 설정할 수 있습니다. 예를 들어, '보호 구역'에서는 나무를 베는 것을 금지하는 법률을 만들어서, 해당 구역을 보호할 수 있습니다.
184;법률과 그 밖의 시스템에서 대상으로 이용 할 수 있도록, 특정 범위를 구역으로 정할 수 있습니다.
185;공직자 직위는 정부의 공식적인 직위로, 정부의 방침을 관리 할 수 있는 권한을 가지고 있습니다. 증명이 필요한 상황에서 해당 직위를 통해서 증명할 수 있습니다(권한, 법률 등 직위가 조건으로 필요한 곳).
공직자 직위는 [GovernmentOfficeItem]에서 생성할 수 있습니다. 생성하려 하는 공직자 직위는 다음과 같은 몇 가지의 조건이 붙습니다.

 - 직위를 누가 맡을 것인가를 [Election Process|Election Processes]을 통해 선출합니다
 - 몇 명에게 해당 공직자 직위를 수여 할 것인지 정해야 합니다
 - 정부를 위해 일할 재직 기간을 설정해야 합니다
 - 해당 직위를 가진 사람이 퇴임하게 되면 그 자리를 어떻게 이을 것인지 정해야 합니다

공직자 직위를 만들 때, 다음과 같은 권한들도 설정할 수 있습니다.

 - [TreasuryItem]에서 세율을 설정할 수 있는 권한
 - 국고 계좌에 보관되어 있는 자금을 이용할 수 있는 권한
 - 개인 재산 통계에 포함되지 않는 정부 은행 계좌를 개설할 수 있는 권한
 - 세계 지도에서 주민들의 확인이 필요한 지점을 마커로 표시할 수 있는 기능의 여부

공직자 직위는 직위를 가지고 있는 주민들이 주기적으로 받는 급여의 설정 권한을 부여받을 수 있습니다.
186;공직자 직위는 정부의 공식적인 직위로, 정부 방침을 관리할 수 있는 권한을 부여받을 수 있습니다.
187;[BoardOfElectionsItem]에서 주민들은 선거의 방식을 직접 설정해, 정부와 지도부의 다양한 형태의 변화를 만들어 낼 수 있습니다.
[Civic Articles]은 선거가 진행하는 도중에도 참조가 가능하므로 선거에 필요한 대처 방법을 확인 할 수 있습니다.  [GovernmentOfficeItem]에서 뽑는 [Elected Titles]의 선거의 경우엔, 해당 직위에 선출이 될 후보자들을 나열해 두어야만 합니다.

선거의 조건 설정에는 투표권자의 집단, 거부권 행사 여부, 선거의 기간, 선거 승리에 필요한 비율 등이 있고, 이는 매 선거마다 설정할 수 있습니다.  주민들은 각각 다른 방식의 선거를 통해 정부에 앉힐 직위의 권력을 분배합니다. 주민들이 이렇게 할 수 있는 이유는, 세계에서 가장 강력한 권력을 가지는 직위도 결국 전 세계의 주민들이 선거를 통해 뽑고, 탄핵 또한 주민들에 의해 당할 수 있기 때문입니다.
188;선거가 진행되는 방식을 규정합니다.
189;선거의 방식은 다음과 같이 두 가지로 나눌 수 있습니다.
 - 공직자 선거 . 해당 선거는 [Elected Titles]를 가진 이가 선거를 통해 특정 시민에게 권한을 부여할 수 있습니다.
 - 국민투표.  해당 선거는 찬성 또는 반대를 표해, 주민의 참정권이 필요한 일을 투표로 결정을 내릴 수 있습니다.

선거는 주민들이 다양한 권리를 이행할 수 있는 [BallotBoxItem] 에서 시작할 수 있습니다.  어떤 [Civic Articles]이 집행되고 있는지에 따라, 권리의 이행에 선거가 필요할 수도, 필요하지 않을 수도 있습니다. 만약 선거가 필요하다면, 즉시 선거를 시작할 수 있습니다.

선거는 [Election Process|Election Processes]에서 정한 방식에 따라 다양한 설정을 할 수 있습니다. 선거에 참여할 수 있는 집단, 거부권의 여부, 선거의 기간, 안건이 통과될 수 있는 찬성의 비율 등을 정할 수 있습니다.  여러 형태의 선거는 각자 다른 목적을 지니고 있습니다. 예를 들어, 정부를 대표하는 이들은 공직자만이 투표할 수 있는 공직자 선거만을 시행할 수 있으며, 반면에 대부분의 주민들은 정부의 대표자를 뽑는 선거만을 시행할 수 있습니다.
190;주민 집단의 여론을 통해서 공직자를 결정하거나, 안건에 대한 국민투표를 시행합니다.
191;행정 업무는 일회성으로 하는 집행이며, 특정 주민 집단 또는 주민 전체에게 즉시 적용할 수 있습니다.
행정 업무는 [ExecutiveOfficeItem]에서 [Civic Action Component]를 이용해 제의할 수 있습니다. 이 집행에는 세 가지의 주요 효과가 있습니다.

 - 특별 [Tax|Taxes] 징수하기
 - 주민에게 [TreasuryItem]에서 자금 대주기
 - 소유하고 있던 [Property]의 소유자 변경하기

시행 중인 [Civic Articles]에 따라, 이러한 집행들은 선거가 필요할 수도 있습니다. [Elected Titles]를 가진 이만 행정 업무를 집행 할 수 있게 하는 몇몇 헌법 조항도 존재합니다.
192;정부의 공직자가 행하는 행정 처분으로, 세금, 부지 등과 관련된 업무를 합니다.
193;'현명한 자들이 정치에 참여하길 거부한다면, 그에 대한 대가는 저질스러운 자들의 정치 아래 살게 되는 것이다.'\n- 플라톤
194;생태계와 경제, 그 사이에서 생존과 번영 모두를 쟁취하려는 주민들에 의해 운영되는 정부가 존재하고 있습니다.
195;    정부는 주민들에 의해 만들어지며, 정부의 권력과 역량이 차근차근 커짐과 동시에 대중들의 힘 또한 같이 커집니다.  정부는 다음과 같이 구성되어 있습니다.
196;[Constitution]정부가 완전히 구성되기 전에 제정할 수 있으며, [CapitolItem]을 이용해 제정할 수 있습니다. 헌법 조항을 통해서 정부의 운영 방향에 관해 결정할 수 있습니다.
197;[Civic Articles]헌법은 정부가 어떻게 기능할지 나열한 헌법조항들로, 누가, 무엇을, 어떻게 할 것인지로 이루어져 있습니다.  [CapitolItem]에서 새로운 헌법을 제정하거나, [AmendmentsItem]를 이용해서 이미 존재하고 있는 헌법에 추가로 개정할 수 있습니다.
198;[Laws]법률은 모든 주민이 무조건 따라야 할 규칙과 절차입니다.  [CourtItem]은 법률을 총 3개까지 유지할 수 있습니다.
199;[Elections]선거는 헌법에서 설정한 대로, 선거가 필요한 안건을 제의할 때 자동으로 시행됩니다. 다음과 같은 경우에 선거가 필요할 수 있습니다 (법률의 개정, 지도자 선출, 행정 업무).
200;[Election Processes]선거 과정을 통해 선거가 어떻게 진행될지 설정할 수 있습니다. 투표권자의 집단과 거부권 행사자, 투표의 기간, 얼마만큼의 득표가 필요한지 등을 설정할 수 있습니다. 선거의 진행은 [BoardOfElectionsItem]에서 세 개까지 가능합니다.
201;[Elected Titles]공직자 직위는 정부에서 특별한 권한을 가진 자리입니다. [GovernmentOfficeItem]당 한 명의 공직자 직위를 뽑을 수 있습니다.
202;[Demographics]인구통계는 특정한 조건에 부합하는 사람을 한 집단으로 묶을 수 있습니다. 해당 집단은 정부와 관련된 부분에서 다양한 방법으로 사용될 수 있습니다.  [CensusBureauItem]에서 인구통계의 구분을 세 개까지 만들 수 있습니다.
203;[Districts]특정 범위의 영역을 설정해 법률 및 그밖에 다른 곳들에서 조건 중 하나로 이용할 수 있습니다.  [ZoningOfficeItem]에서 구역지도를 세 개까지 생성할 수 있습니다.
204;[Executive Actions]행정 업무는 일회성으로 법률을 제정하여 집행해 사회에 변화를 줄 수 있습니다. 헌법에서 권한을(공직자 직위) 부여받은 플레이어가 [ExecutiveOfficeItem]에서 집행할 수 있습니다.
205;  [Ballot Boxes|Civic Action Component]
  투표함을 이용해 선거와 공직 유지와 관련된 선거를 시행 할 수 있습니다.
206;  [Treasury|Treasury Component]
  경제의 다양한 부분에 세금을 도입할 수 있습니다.
207;공공의 이익을 증진을 위해 설계된 제도로 운영되고 있는 기관입니다.
209;법률은 정부가 대중들이 이루고자 하는 목표를 이뤄 세계를 변화시키기 위해 필요한 수단입니다.
법률은 [CourtItem]를 설치해 제정할 수 있고, [Civic Articles]에 따라 해당 법률의 통과에 선거가 필요한지 결정됩니다.  각 법률은 요건과 효과로 이루어진 목록들이 생성되며, 이를 이용해 법률요건에 충족되는 상황이 발생 시, 법률효과가 발생합니다.  이를 통해 법률을 더욱 유연하게 다방면으로 사용할 수 있게 되며, 세금 걷는 법을 규정하는 것부터 자금을 지원하는 것까지, 다양한 분야를 다룰 수 있게 됩니다.

'요건(조건)'의 다양성은 누가 조건을 충족했는지, 어디서 충족했는지 등의  전체적인 상황을 묘사할 수 있습니다. 이 '전체 상황'의 특성은 법률요건의 툴팁에서 확인 가능하며, 이를 통해 데이터를 특정하여 '효과'를 발생시킬 수 있습니다.  예를 들어, 나무를 베는 행동을 한 특정 플레이어에게 세금을 부과하는 법률효과를 발생시킵니다.
210;요건-충족-효과인 인과관계의 규칙은 주민들에 의해 제정되고, 사회적 목표를 달성하기 위하여 자동으로 시행됩니다.
211;주민들의 이익을 위해, 또는  적어도 정부의 자금난을 막기 위해, Eco의 세계에선 다양한 활동에 세금이 부과될 수 있습니다.
국고적 세금
[TreasuryItem]에서, 다음과 같이 다양한 활동에 세금을 부과 할 수 있습니다.
 - 판매세.  상점을 통해 물품을 거래할 때 세금이 부과됩니다.
 - 작업대 사용세. 자신이 소유하고 있는 작업대를 이용하게 해주어 요금을 부과합니다.
 - 계약자세. 계약과 동업 계약에 성공해 얻은 자금에서 세금이 부과됩니다.
 - 직접 양도세. 플레이어가 다른 플레이어에게 자금을 양도할 시 세금이 부과됩니다.
 - 자기 양도세. 플레이어에게 권한이 있는 다른 계좌에 자금을 옮길 경우 세금이 부과됩니다 (탈세를 방지하기 위해 설정할 수 있습니다).

[Elected Title|Elected Titles]를 가지고 있는 주민만이 '국고에서의 세금 비율 설정'의 권한이 부여됩니다.  설정해둔 모든 세금은 특수한 '국고' 계좌에 입금되도록 설정되어 있습니다.  국고의 특수한 기능을 이용하여 '국고' 계좌의 자금을 다른 계좌에 할당할 수 있습니다.

법적 세금
세금은 [Laws]을 통해서도 부과할 수 있으며, 부과 금액과 세금 보관 계좌는 유동적으로 변경할 수 있습니다. 세금을 보관할 계좌를 직접 설정할 수 있어, 그렇게 모인 자금을 특정한 주민에게 지급할 수 있으며, 해당 계좌는 권한을 가진 플레이어만이 접근 할 수 있습니다. 법률 제도를 이용한 세금은 특별한 목적을 위해 부과하는 것으로, 이는 상황에 따라 조절될 수 있습니다.

이에 관한 예시로, 공직자 직위인 '운수부 장관'의 직위를 가진 주민이 사용할 수 있도록 운수부를 위한 단독 [Bank Account|Bank Accounts]를 개설할 수 있습니다.  그 이후 연료의 생산 및 거래와 관련된 조세 법률을 제정해, 이를 통해 거두어진 세금을 운수부 자금으로 사용해, 선출된 운수부 장관이 이를 사업 자금으로 사용해 [Work Parties]으로 새로운 도로 공사를 실시 할 수 있게 됩니다.
212;경제 활동으로 인해 거두어진 세금을 이용해 공공사업에 자금을 지원해 도와주듯이, 경제적인 활동을 장려하거나, 저해 할 수 있습니다.
213;직위는 플레이어들을 기준에 따라 나눈 집단으로, 권한을 부여할 때 선택할 집단으로 사용할 수 있습니다.  이는 [Demographics]과는 다른 개념입니다. 직위는 주민들이 직접 지정한 집단이지만, [Demographics]은 조건에 충족하는 주민들을 집단에 자동으로 포함시킴으로, 이와 같은 차이점이 있습니다.
직위에는 다음과 같은 두 가지의 형태가 있습니다.

 - 일반 직위. 이 직위는 [RegistrarItem]에서 누구나 생성하고 관리할 수 있습니다.  이 곳에서, 직위를 만든 주민은 상대방에게 직위의 역할을 맡기고 관리하는 (관리자)의 역할을 부여할 수 있습니다.
 - 공직자 직위. 이 직위는 [GovernmentOfficeItem]에서 생성할 수 있으며 선거(또는 임명)를 통해 해당 직위를 받을 수 있습니다. 정부 부서의 기능을 통해서 주어진 직위에 어떤 종류의 [Election]가 필요한지 결정하게 됩니다.  직위의 소유자가 해임당하거나, 소유자가 사임할 경우(두 경우 모두 [BallotBoxItem]를 통해 이루어집니다), 또는 정해진 기간을 다 채웠을 때 직위가 해제됩니다.

공직자 직위는 세계를 통치하는 데 있어 다양한 유연함을 제공하며, 그 직위만의 특권은 계좌 자체에 묶이게 됩니다. 그 예시로, 운송수단을 이용하는 데에 세금을 부과하는 법률이 제정한 후, 거두어들인 세금은 '운송부 장관'만이 접근할 수 있는 계좌로 이동합니다. 이후 해당 직위의 선거가 시행되고 임명자가 바뀌게 된다면, 전 직위의 소유자는 해당 계좌에 접근할 수 있는 특권이 사라져 버리게 되는 것입니다.

공직자 직위의 조건을 설정함으로써, 주민이 자식의 직무를 수행하는 것을 보장해 좋은 정치를 이어나갈 수 있게 됩니다. 그 예시로,  모든 직위의 조건에 '활동적임' 인구 계층의 조건을 붙임으로써, 직위를 가지고 있는 사람들이 계속 접속하여 직무를 수행할 수 있게 됩니다. 이후, 만약 직위 소유자가 접속하지 않는 비활동 상태로 바뀐다면 자동으로 직위에서 해제되며, 후계로 명시된 인물이 해당 직위에 들어가게 됩니다.

또한, 직위 소유자에게는 급여를 지급할 수 있습니다. 급여는 주민이 직무를 지속적으로 수행한다면(급여 지급자가 자금이 충분할 경우에) 정기적으로 지급 됩니다.
214;직위는 다수의 주민이 소유할 수 있습니다.  권한을 부여하거나 급여를 지급하는 데에 사용됩니다.
215;주민들은 주거지 없이는 번영에 다가갈 수 없습니다, 또한 [Nutrition] 수치와 더불어 하우징 수치는 플레이어의 [Experience] 배율을 결정합니다.  주거지의 재료 등급이 높을수록, 가구의 종류가 더 다양할수록, 경험치의 배율 또한 높아집니다.
추가로, 구조물들을 작동시키기 위해 주거지와 조건을 갖춰야 합니다. 하우징 시스템은 다음과 같은 부분들로 이루어져 있습니다.
 - [Rooms]. 방은 완벽한 공간의 형태를 띄어야 하며, 대부분의 구조물은 방 안에 설치되어야만 작동하는 조건이 있습니다 .
 - [Property]. 주민들은 일정 범위의 땅을 소유하여, 해당 부지를 자신만의 땅으로 만들 수 있습니다.
 - [Power]. 다양한 물품들은 작동하기 위해선 에너지가 필요하며, 생산한 에너지는 다른 주민들과 공유할 수 있습니다.
 - [Sewage].  일부 물품들은 파이프와 펌프, 그리고 폐수 처리 시설을 필요로 합니다.
216;하우징(식단을 포함하여)은 스킬 포인트의 획득 비율을 결정합니다.
217;다양한 구조물들을 작동시키기 위해선 에너지가 필요합니다, 그리고 사회가 발전해 감에 따라 에너지의 종류 또한 다양해집니다.
게임의 초반부, 대부분의 에너지는 주민들의 칼로리 소모를 통해 만들어낼 수 있습니다.  그 다음 단계로는, [Waterwheels|Waterwheel Item]와 같이 근처에 있는 구조물에만 전력을 보낼 수 있는 전력 생산 구조물을 설치할 수 있습니다.  에너지 생산 기술의 단계가 전력까지 도달하게 된다면, 전 구역을 지탱할 수 있는 에너지를 생산할 수 있게 되어, 모두가 에너지 공급원을 마련할 필요 없이, 서로가 협력하여 도시와 마을에 전력을 공급하는 에너지 단지를 만들 수 있습니다. (이와 같은 대규모 작업의 경우, 자금을 모으기 위한 [Taxes] 시스템과 건축을 위해 [Contracts]과 [Work Parties]을 이용하는 게 유용합니다).

에너지를 생산하는 시설의 종류는 다양하기에, 해당 시설마다 사용하는 연료와, 환경에 미치는 영향 또한 각자 다릅니다.  기술의 발전과 더불어, 에너지 생산 시설의 건설, 연료 공급, 시설 운영 등은 [Pollution]의 주요한 원인이 되며, 그렇기에 주민들은 사용되는 에너지의 종류를 규제하고 오염을 관리하는 법을 통해 생태계에 다가오는 참사를 막아야만 할 것입니다.
218;다양한 구조물은 작동시키기 위해서는, 다양한 방법으로 생산해낸 에너지가 필요합니다.
219;    부지의 소유권을 주장하여, 주민들은 자신의 부지를 보호할 수 있고, 상대방에게 부지를 이용할 수 있는 권한과 부지 안의 구조물들을 사용할 수 있는 권한을 설정할 수 있습니다.
220;토지 소유 권리
221;  소유되어있지 않은 땅 위에서 [Land Claim Stake|Property Tool Item]을 이용해 사유지로 설정할 수 있습니다.  사용할 장소를 결정했다면, [Land Claim Paper|Property Claim Item]을 소모하여, 해당 부지의 증서를 소유하게 됩니다. 화면 오른쪽 아래의 세계지도 왼편에 나타나는 부지의 이름을 클릭해, 현재 자신의 위치에 해당하는 부지 주인의 증서를 확인할 수 있습니다.
222;구조물 소유 권리
223;구조물에는 구조물이 위치한 부지의 소유와는 별개로, 개인 부지의 구조물을 사용하고자 하는 이에게 권한을 설정해줄 수 있습니다.  이 설정은 [Authorization Component]를 통해 지정할 수 있습니다.
224;증서
225;증서 창에선, 주민들은 상대방에게 땅의 이용(블럭을 설치하거나 제거할 수 있는) 권한을 추가하거나 제거할 수 있습니다.  소유자는 자신의 이름 옆 톱니바퀴를 클릭해 소유 권한을 넘길 수 있습니다.  증서에서 [Elected Titles]를 포함해 [Demographics]과 [Titles]를 대상으로도 양도가 가능합니다. 이 방법으로 정부의 구조를 구축하려면 선출된 직위의 소유자가 해당 부지에 권한을 가지고 있어야만 합니다.
226;주민과 정부는 부지를 소유할 수 있으며, 그 부지의 권한에 대해 설정할 수 있습니다.
227;방은 외부 요소들로부터 보호할 수 있도록, 외부와 맞닿아 있는 모든 부분이 벽, 문, 창문으로 이루어져 있는 밀폐된 구역입니다.
방의 정보를 보고 싶은 방 안에 들어가, 화면 오른쪽 지도 옆 정보를 통해 확인할 수 있습니다. 대부분의 구조물은 방 안에 설치되어야 하는 조건이 있고, 설치하게 된다면 일정한 공간을 차지하게 되며, 구조물의 조건에 맞는 특정한 단계 이상의 재료로 방이 지어져야 합니다. 방을 이루는 재료의 단계에 따라 하우징 수치에도 영향을 미칩니다.  이 말은 즉, 벽돌로 지은 집은 흙더미로 쌓아 올린 집보다 다방면으로 더욱 도움이 된다는 뜻입니다.


가구와 방의 종류
부지를 소유권을 주장하고 그 부지에 건물(방)을 세워, 접속 중이 아니더라도 지속되는 경험치 배율 효과를 획득할 수 있습니다.  다른 유형의 방을 추가로 건설하고 가구를 들여놓아서 해당 경험치 효과를 증가시킬 수 있습니다.  가구의 종류에 따라 화장실, 침실, 부엌 또는 거실로, 방의 유형이 결정됩니다 (물품의 툴팁에 종류가 표기되어 있습니다).  방 안에 설치된 가구의 유형 수치 중 가장 높은 종류를 따라 방의 유형이 결정됩니다. 방의 유형을 결정하는 유형 수치는 각 방 안에 있는 가구들의 수치의 총합으로 계산됩니다.

방 안의 가구가 중복되거나, 같은 유형의 방이 중복될 경우 집에서 획득하는 하우징 수치가 수확 체감을 가지게 됩니다. 이 효과는, 중복되더라도 수치가 오르는 건 변함 없지만, 처음 올랐던 수치보다 더욱 낮은 수치를 얻게 될 것입니다.   수확 체감의 효과로 인해 중복될수록 결국 획득하는 수치는 극도로 낮아져, 가구나 방을 추가하는 것이 더 이상 의미가 없어지게 될 것입니다.  그 예시로, 12번째 화장실을 설치하게 된다면 처음 건설했던 화장실로 올라간 수치보다 더욱 낮아진 하우징 수치를 획득하게 될 것입니다.

방을 이루는 재료의 단계
재료의 단계의 평균 값 또한 하우징 수치를 결정하는 데 영향을 미치는데, 이는 경험치 배율(하우징)의 상한선과 관련되어 있습니다.  방의 수치가 재료에 따른 상한선을 넘어버린 경우, 이 또한 수확 체감으로 인해 오르게 되는 하우징(경험치 배율) 수치의 값이 낮아집니다.  이러한 현상이 일어난다면, 방을 이루는 재료의 종류를 바꿀 때가 되었다는 뜻입니다.
228;방은 당신과 당신이 가지고 있는 장치들을 외부 요소로부터 지켜주며, 경험치 획득 배율 수치가 올라가며, 장치들을 작동 할 수 있게 됩니다.
229;다양한 산업 구조물과 하우징에 관련된 구조물들은 작동을 위해선 하수 시스템이 필요합니다.  일반적으로, 해당 시스템은 물이 들어올 지점과 하수가 나올 지점이 필요합니다.  모든 구조물에는 하수 처리에 사용되는 [Pipe Component]를 가지고 있습니다.

